{
  "schema_version": "1.0",
  "id": "TASK-001",
  "project_id": "PRJ-001",
  "owner_batch": "B05",
  "title": "Example task",
  "status": "proposed",
  "revision": 1,
  "requirement_ids": [],
  "dependency_ids": [],
  "assigned_branch": "example",
  "result_sha": "0000000000000000000000000000000000000000",
  "test_ids": [],
  "evidence_ids": []
}
